[
  {
    "evidence_type_id": "EVID-ROPA-01",
    "title": "Data Processing Activities Inventory (RoPA)",
    "description": "Comprehensive structured inventory mapping personal data flows, processing purposes, legal grounds, storage repositories, processors, and retention periods.",
    "linked_controls": [
      "TLI-DPDP-SCO-01",
      "TLI-DPDP-LGL-01",
      "TLI-DPDP-LEG-01",
      "TLI-DPDP-LEG-02",
      "TLI-DPDP-XBD-01"
    ],
    "status": "MANDATORY",
    "confidentiality_tier": "TIER-2 (Internal Confidential)",
    "recommended_freshness": "Annual / Major Architecture Change",
    "acceptable_examples": [
      "Enterprise data inventory spreadsheet",
      "Privacy management software export (e.g. OneTrust, TrustArc)",
      "Internal RoPA database report"
    ],
    "alternative_evidence": "Enterprise Data Flow Diagrams (DFDs) paired with systems integration matrices.",
    "verification_procedure": [
      "Inspect whether each business unit (HR, IT, Marketing, FinTech) has contributed data flows.",
      "Verify that each activity lists a specific statutory ground (Section 6 Consent or Section 7 clause).",
      "Confirm that personal data categories (Identity, Financial, Device) are itemised."
    ],
    "limitations_and_weaknesses": "High-level network topology diagrams that do not identify personal data elements or processing purposes fail this requirement.",
    "masking_and_redaction_requirements": "Sanitize internal database IP addresses and credentials; ensure no live employee or customer records are present.",
    "retention_considerations": "Retain with assessment working papers for statutory audit lifecycle.",
    "reviewer_guidance": "Cross-check RoPA entries against the controls evaluated in the assessment to ensure scope completeness."
  },
  {
    "evidence_type_id": "EVID-NOT-01",
    "title": "Pre-Consent Itemised Notice Artifacts",
    "description": "Verifiable copies and UI screenshots of standalone pre-consent privacy notices presented to Data Principals at collection touchpoints.",
    "linked_controls": [
      "TLI-DPDP-NOT-01",
      "TLI-DPDP-DSR-03"
    ],
    "status": "MANDATORY",
    "confidentiality_tier": "TIER-1 (Public Governance)",
    "recommended_freshness": "Current Live Production",
    "acceptable_examples": [
      "High-resolution screenshots of live mobile app registration screens",
      "Web signup forms with standalone notice text",
      "Scanned paper onboarding consent sheets"
    ],
    "alternative_evidence": "Staging/UAT environment walk-through video recordings with code commit hash tags.",
    "verification_procedure": [
      "Check that notice is presented before or at the time of consent capture.",
      "Verify presence of: (a) itemised personal data list, (b) specified purpose, (c) Section 11 rights description, (d) DPBI complaint procedure, (e) Grievance Officer details."
    ],
    "limitations_and_weaknesses": "Submitting a general website footer link to a 20-page legal policy does not satisfy pre-consent notice requirements.",
    "masking_and_redaction_requirements": "Ensure sample screenshots use dummy/synthetic user inputs (e.g., testuser@example.com).",
    "retention_considerations": "Historical screenshots must be version-linked to the corresponding notice revision.",
    "reviewer_guidance": "Scrutinize the notice for bundled marketing consent or coercive language."
  },
  {
    "evidence_type_id": "EVID-NOT-02",
    "title": "Multilingual Notice Mechanism Proof",
    "description": "Proof of technical capability allowing Data Principals to access notice contents in English or any of the 22 Eighth Schedule languages.",
    "linked_controls": [
      "TLI-DPDP-NOT-03"
    ],
    "status": "MANDATORY",
    "confidentiality_tier": "TIER-1 (Public Governance)",
    "recommended_freshness": "Current Live Production",
    "acceptable_examples": [
      "Screenshots of live language selector toggle displaying regional languages (Hindi, Tamil, Telugu, Bengali, etc.)",
      "Certified translation files integrated into CMS repository"
    ],
    "alternative_evidence": "API documentation and UI walkthrough of localized CMS delivering regional language content based on browser preference.",
    "verification_procedure": [
      "Verify the language toggle provides accessibility across Eighth Schedule languages.",
      "Review sample regional translations to confirm they convey statutory notices accurately."
    ],
    "limitations_and_weaknesses": "Relying on unconfigured generic third-party browser translation plugins without native platform support fails Section 5(3).",
    "masking_and_redaction_requirements": "None (public UI artifacts).",
    "retention_considerations": "Maintain records of certified translations alongside release version numbers.",
    "reviewer_guidance": "Test the toggle mechanism in consumer workflows."
  },
  {
    "evidence_type_id": "EVID-NOT-03",
    "title": "Legacy User Grandfathering Notice Plan",
    "description": "Documented implementation plan and communication artifacts demonstrating delivery of post-enactment notices to data principals whose consent was acquired prior to commencement.",
    "linked_controls": [
      "TLI-DPDP-NOT-02"
    ],
    "status": "CONDITIONAL",
    "confidentiality_tier": "TIER-2 (Internal Confidential)",
    "recommended_freshness": "One-time Campaign Record",
    "acceptable_examples": [
      "Grandfathering notice campaign execution plan",
      "Draft email/SMS notification copy",
      "Email service provider dispatch telemetry logs (aggregated counts)",
      "Customer portal in-app notice push banners"
    ],
    "alternative_evidence": "Staged communication rollout schedule approved by legal with pilot cohort delivery proof.",
    "verification_procedure": [
      "Inspect notice content for itemised categories, specified purposes, rights, and grievance contact.",
      "Confirm that delivery does not alter underlying service access pending principal review.",
      "Verify delivery tracking telemetry (aggregated counts, delivery success rates)."
    ],
    "limitations_and_weaknesses": "Merely publishing a notice on a static website without dispatching notice directly to legacy users fails Section 5(2).",
    "masking_and_redaction_requirements": "Mask individual recipient email addresses and telephone numbers; use synthetic dispatch samples.",
    "retention_considerations": "Retain campaign records for statutory audit and enforcement defense lifecycle.",
    "reviewer_guidance": "Verify whether inactive or dormant user accounts are covered by the grandfathering notice campaign or targeted for erasure."
  },
  {
    "evidence_type_id": "EVID-CON-01",
    "title": "Affirmative Consent Capture UI Flow & Logs",
    "description": "Visual proof of unbundled, unticked consent UI and technical schema of immutable consent log receipts.",
    "linked_controls": [
      "TLI-DPDP-CON-01",
      "TLI-DPDP-CON-03"
    ],
    "status": "MANDATORY",
    "confidentiality_tier": "TIER-2 (Internal Confidential)",
    "recommended_freshness": "Current Live Production",
    "acceptable_examples": [
      "UI screenshots showing unticked checkboxes alongside granular purpose toggles",
      "Database schema and sample JSON payload of a consent audit record (with timestamp, notice version, user ID, IP address)"
    ],
    "alternative_evidence": "Automated Playwright/Cypress end-to-end consent test execution logs.",
    "verification_procedure": [
      "Verify that checkboxes are unchecked by default (zero dark patterns).",
      "Confirm that service provision is not conditioned upon consent for optional secondary purposes.",
      "Inspect consent log schema for timestamp, notice version ID, and affirmative action indicator."
    ],
    "limitations_and_weaknesses": "Pre-ticked boxes or bundled 'I agree to all' single checkboxes fail Section 6(1).",
    "masking_and_redaction_requirements": "Sample database records must use synthetic user IDs (user_synthetic_001) and masked IP addresses (192.0.2.1).",
    "retention_considerations": "Consent records must be retained for the life of the processing activity plus statutory limitation periods.",
    "reviewer_guidance": "Check whether consent can be proven in an adversarial DPBI dispute."
  },
  {
    "evidence_type_id": "EVID-CON-02",
    "title": "Consent Withdrawal Interface & Workflow",
    "description": "Evidence of self-service consent revocation interfaces and backend workflows halting data processing upon withdrawal.",
    "linked_controls": [
      "TLI-DPDP-CON-02"
    ],
    "status": "MANDATORY",
    "confidentiality_tier": "TIER-2 (Internal Confidential)",
    "recommended_freshness": "Current Live Production",
    "acceptable_examples": [
      "Screenshots of user account privacy settings showing 1-click consent toggle off",
      "Backend webhook documentation triggering data de-indexing and processing cessation"
    ],
    "alternative_evidence": "Video recording of a test user revoking consent in a mobile application with immediate notification receipt.",
    "verification_procedure": [
      "Count clicks/actions required to grant consent vs clicks/actions required to revoke.",
      "Verify that withdrawal triggers automated message to downstream processors."
    ],
    "limitations_and_weaknesses": "Forcing users to email support or call a contact center to withdraw consent given digitally violates the 'comparable ease' test.",
    "masking_and_redaction_requirements": "Use test accounts with synthetic profile data.",
    "retention_considerations": "Retain withdrawal audit logs for statutory compliance verification.",
    "reviewer_guidance": "Test the withdrawal path in standard consumer accounts."
  },
  {
    "evidence_type_id": "EVID-DPA-01",
    "title": "Executed Data Processing Agreements (DPA)",